{
  "$schema": "https://ifquant.org/contracts/platform/v1/image-manifest.schema.json",
  "contract_type": "ifquant_platform_image_manifest",
  "contract_version": "1.0.0",
  "image_id": "phase3-image-002",
  "biological_unit_id": "phase3-unit-002",
  "source_artifact": {
    "source_uri": "source-002.bin",
    "sha256": "16eb742e1d681051b99ebb93c2cb6011df7ba7f2c88a1bee09a60f2c7094e730",
    "size_bytes": 28,
    "media_type": "application/octet-stream"
  },
  "dimensions": {"width_pixels": 100, "height_pixels": 100, "z_planes": 1, "timepoints": 1},
  "pixel_calibration": {"calibration_id": "phase3-calibration-002", "pixel_width_um": 0.5, "pixel_height_um": 0.5, "z_spacing_um": null, "unit": "um"},
  "coordinate_space": {"coordinate_space_id": "phase3-pixels-002", "dimension": "2d", "geometry_unit": "pixel", "axis_order": ["x", "y"], "origin": "top_left", "x_axis_direction": "right", "y_axis_direction": "down"},
  "acquisition": {"mouse_id": "phase3-mouse-001", "specimen_id": null, "section_id": null, "slide_id": "phase3-slide-002", "batch_id": "phase3-batch-shared", "scanner_id": "phase3-scanner-shared", "acquired_at": null},
  "provenance": {"created_at": "2026-08-30T00:00:00Z", "producer_id": "ifquant_phase3_fixture_builder", "producer_version": "0.1.0", "code_sha256": "93b7271e9192df92b5fa5a2a6aa4207fe77bb629213c7a5c6ba8da3d11ed0d1b", "ingest_config_sha256": "3b363c6b5bc28095a7fc068bf750db6166d6034444feedc8d00b6c064a662942"}
}
