{
  "$schema": "https://ifquant.org/contracts/platform/v1/image-manifest.schema.json",
  "contract_type": "ifquant_platform_image_manifest",
  "contract_version": "1.0.0",
  "image_id": "synthetic-image-001",
  "biological_unit_id": "synthetic-unit-001",
  "source_artifact": {
    "source_uri": "source-pixels.bin",
    "sha256": "1bd18a4f00726cb8dc04f70e3e9db0ff3f480bdae06f01ede381f54e6a82ec68",
    "size_bytes": 30,
    "media_type": "application/octet-stream"
  },
  "dimensions": {
    "width_pixels": 100,
    "height_pixels": 100,
    "z_planes": 1,
    "timepoints": 1
  },
  "pixel_calibration": {
    "calibration_id": "synthetic-calibration-001",
    "pixel_width_um": 0.5,
    "pixel_height_um": 0.5,
    "z_spacing_um": null,
    "unit": "um"
  },
  "coordinate_space": {
    "coordinate_space_id": "synthetic-image-pixels-001",
    "dimension": "2d",
    "geometry_unit": "pixel",
    "axis_order": ["x", "y"],
    "origin": "top_left",
    "x_axis_direction": "right",
    "y_axis_direction": "down"
  },
  "acquisition": {
    "mouse_id": "synthetic-mouse-001",
    "specimen_id": "synthetic-specimen-001",
    "section_id": "synthetic-section-001",
    "slide_id": "synthetic-slide-001",
    "batch_id": "synthetic-batch-001",
    "scanner_id": "synthetic-scanner-001",
    "acquired_at": null
  },
  "provenance": {
    "created_at": "2026-08-29T00:00:00Z",
    "producer_id": "ifquant_fixture_builder",
    "producer_version": "0.1.0",
    "code_sha256": "1111111111111111111111111111111111111111111111111111111111111111",
    "ingest_config_sha256": "2222222222222222222222222222222222222222222222222222222222222222"
  }
}

